,Title,Year,Rated,Released,Runtime,Genre,Director,Writer,Actors,Plot,Language,Country,Oscars_won,Oscars_nom,Metascore,imdbRating,imdbVotes,imdbID,DVD,USBoxOffice_Inf,Production
159,Dial M for Murder,1954.00,PG,29-May-54,105 min,"Crime, Film-Noir, Thriller",Alfred Hitchcock,"Frederick Knott (screen play), Frederick Knott (adapted from his play)","Ray Milland, Grace Kelly, Robert Cummings, John Williams","An ex-tennis pro carries out a plot to murder his wife. When things go wrong, he improvises a brilliant plan B.",English,USA,0.00,0.00,N/A,8.20,116207.00,tt0046912,7-Sep-04,N/A,Warner Bros. Pictures
160,Gran Torino,2008.00,R,9-Jan-09,116 min,Drama,Clint Eastwood,"Nick Schenk (screenplay), Dave Johannson (story), Nick Schenk (story)","Clint Eastwood, Christopher Carley, Bee Vang, Ahney Her","Disgruntled Korean War veteran Walt Kowalski sets out to reform his neighbor, a Hmong teenager who tried to steal Kowalski's prized possession: a 1972 Gran Torino.","English, Hmong","Germany, USA",0.00,0.00,72.00,8.20,598907.00,tt1205489,9-Jun-09,178955200.00,Warner Bros. Pictures/Village Roadshow
161,The Deer Hunter,1978.00,R,23-Feb-79,183 min,"Drama, War",Michael Cimino,"Michael Cimino (story), Deric Washburn (story), Louis Garfinkle (story), Quinn K. Redeker (story), Deric Washburn (screenplay)","Robert De Niro, John Cazale, John Savage, Christopher Walken",An in-depth examination of the ways in which the U.S. Vietnam War impacts and disrupts the lives of people in a small industrial town in Pennsylvania.,"English, Russian, Vietnamese, French","USA, UK",5.00,0.00,81.00,8.20,249067.00,tt0077416,6-Sep-05,188591300.00,Universal Pictures
162,Hacksaw Ridge,2016.00,R,4-Nov-16,139 min,"Biography, Drama, History",Mel Gibson,"Robert Schenkkan (screenplay), Andrew Knight (screenplay)","Andrew Garfield, Richard Pyros, Jacob Warner, Milo Gibson","WWII American Army Medic Desmond T. Doss, who served during the Battle of Okinawa, refuses to kill people, and becomes the first man in American history to receive the Medal of Honor without firing a shot.","English, Japanese","Australia, USA",2.00,0.00,71.00,8.20,221901.00,tt2119532,21-Feb-17,68874400.00,Summit Entertainment
163,Gone with the Wind,1939.00,G,17-Jan-40,238 min,"Drama, History, Romance","Victor Fleming, George Cukor, Sam Wood","Margaret Mitchell (story of the old south ""Gone with the Wind""), Sidney Howard (screenplay)","Thomas Mitchell, Barbara O'Neil, Vivien Leigh, Evelyn Keyes",A manipulative woman and a roguish man conduct a turbulent romance during the American Civil War and Reconstruction periods.,English,USA,8.00,0.00,97.00,8.20,230951.00,tt0031381,7-Mar-00,1802000000.00,Loew's Inc.
164,Fargo,1996.00,R,5-Apr-96,98 min,"Crime, Drama, Thriller","Joel Coen, Ethan Coen","Ethan Coen, Joel Coen","William H. Macy, Steve Buscemi, Peter Stormare, Kristin Rudrí_d",Jerry Lundegaard's inept crime falls apart due to his and his henchmen's bungling and the persistent police work of the quite pregnant Marge Gunderson.,English,"USA, UK",2.00,0.00,85.00,8.10,490860.00,tt0116282,24-Jun-97,49724900.00,MGM
165,The Big Lebowski,1998.00,R,6-Mar-98,117 min,"Comedy, Crime","Joel Coen, Ethan Coen","Ethan Coen, Joel Coen","Jeff Bridges, John Goodman, Julianne Moore, Steve Buscemi","""The Dude"" Lebowski, mistaken for a millionaire Lebowski, seeks restitution for his ruined rug and enlists his bowling buddies to help get it.","English, German, Hebrew, Spanish","USA, UK",0.00,0.00,69.00,8.20,580796.00,tt0118715,27-Oct-98,33526900.00,Gramercy Pictures
166,The Sixth Sense,1999.00,PG-13,6-Aug-99,107 min,"Drama, Mystery, Thriller",M. Night Shyamalan,M. Night Shyamalan,"Bruce Willis, Haley Joel Osment, Toni Collette, Olivia Williams",A boy who communicates with spirits that don't know they're dead seeks the help of a disheartened child psychologist.,"English, Latin, Spanish",USA,0.00,6.00,64.00,8.10,754842.00,tt0167404,28-Mar-00,518787900.00,Hollywood/Buena Vista
167,The Thing,1982.00,R,25-Jun-82,109 min,"Horror, Mystery, Sci-Fi",John Carpenter,"Bill Lancaster (screenplay), John W. Campbell Jr. (story)","Kurt Russell, Wilford Brimley, T.K. Carter, David Clennon",A research facility in Antarctica comes across an alien force that can become anything it touches with 100% accuracy. The members must now find out who's human and who's not before it's too late.,"English, Norwegian",USA,0.00,0.00,57.00,8.20,281843.00,tt0084787,28-Aug-01,60157900.00,Universal Pictures
168,Finding Nemo,2003.00,G,30-May-03,100 min,"Animation, Adventure, Comedy","Andrew Stanton, Lee Unkrich","Andrew Stanton (original story by), Andrew Stanton (screenplay), Bob Peterson (screenplay), David Reynolds (screenplay)","Albert Brooks, Ellen DeGeneres, Alexander Gould, Willem Dafoe","After his son is captured in the Great Barrier Reef and taken to Sydney, a timid clownfish sets out on a journey to bring him home.",English,USA,1.00,0.00,90.00,8.10,756517.00,tt0266543,7-May-13,507600600.00,Walt Disney Pictures
169,Tokyo Story,1953.00,NOT RATED,13-Mar-72,136 min,Drama,YasujiríÇ Ozu,"KíÇgo Noda (scenario), YasujiríÇ Ozu (scenario)","Chishíé Ryíé, Chieko Higashiyama, Setsuko Hara, Haruko Sugimura",An old couple visit their children and grandchildren in the city; but the children have little time for them.,"Japanese, English",Japan,0.00,0.00,N/A,8.20,31364.00,tt0046438,30-Oct-03,N/A,BFI Production
170,No Country for Old Men,2007.00,R,21-Nov-07,122 min,"Crime, Drama, Thriller","Ethan Coen, Joel Coen","Joel Coen (screenplay), Ethan Coen (screenplay), Cormac McCarthy (novel)","Tommy Lee Jones, Javier Bardem, Josh Brolin, Woody Harrelson",Violence and mayhem ensue after a hunter stumbles upon a drug deal gone wrong and more than two million dollars in cash near the Rio Grande.,"English, Spanish",USA,4.00,0.00,91.00,8.10,666081.00,tt0477348,7-Apr-09,95342400.00,Miramax Films
171,Rang De Basanti,2006.00,NOT RATED,26-Jan-06,157 min,"Comedy, Drama, History",Rakeysh Omprakash Mehra,"Renzil D'Silva (screenplay), Prasoon Joshi (dialogue), Rakeysh Omprakash Mehra (screenplay), Kamlesh Pandey (story)","Aamir Khan, Siddharth, Sharman Joshi, Kunal Kapoor","This story is about six friends who help an English filmmaker create a documentary about Indian freedom struggle. During filming, this group of friends learn about those before them and the importance of fighting for their rights.","Hindi, Panjabi, English",India,0.00,0.00,N/A,8.30,81768.00,tt0405508,1-Jan-98,3023100.00,N/A
172,The Passion of Joan of Arc,1928.00,NOT RATED,25-Oct-28,114 min,"Biography, Drama, History",Carl Theodor Dreyer,"Joseph Delteil, Carl Theodor Dreyer","Maria Falconetti, Eugene Silvain, Andrí© Berley, Maurice Schutz","A chronicle of the trial of Jeanne d'Arc on charges of heresy, and the efforts of her ecclesiastical jurists to force Jeanne to recant her claims of holy visions.",French,France,0.00,0.00,N/A,8.30,29440.00,tt0019254,9-Nov-99,N/A,Criterion Collection
173,Cool Hand Luke,1967.00,PG,1-Nov-67,126 min,"Crime, Drama",Stuart Rosenberg,"Donn Pearce (screenplay), Frank Pierson (screenplay), Donn Pearce (novel)","Paul Newman, George Kennedy, J.D. Cannon, Lou Antonio",A man refuses to conform to life in a rural prison.,English,USA,1.00,0.00,N/A,8.20,128345.00,tt0061512,3-Nov-97,N/A,Warner Bros.
174,Rebecca,1940.00,APPROVED,12-Apr-40,130 min,"Drama, Mystery, Romance",Alfred Hitchcock,"Daphne Du Maurier (celebrated novel), Robert E. Sherwood (screen play), Joan Harrison (screen play), Philip MacDonald (adaptation), Michael Hogan (adaptation)","Laurence Olivier, Joan Fontaine, George Sanders, Judith Anderson",A self-conscious bride is tormented by the memory of her husband's dead first wife.,"English, French",USA,2.00,0.00,N/A,8.20,94586.00,tt0032976,13-Mar-01,N/A,United Artists
175,A Wednesday,2008.00,NOT RATED,5-Sep-08,104 min,"Crime, Drama, Mystery",Neeraj Pandey,"Neeraj Pandey (story), Neeraj Pandey (script)","Anupam Kher, Naseeruddin Shah, Jimmy Shergill, Deepal Shaw",A retiring police officer reminisces about the most astounding day of his career. About a case that was never filed but continues to haunt him in his memories - the case of a man and a Wednesday.,"Hindi, English",India,0.00,0.00,N/A,8.30,52217.00,tt1280558,2-Dec-08,N/A,UTV Communications
176,There Will Be Blood,2007.00,R,25-Jan-08,158 min,"Drama, History",Paul Thomas Anderson,"Paul Thomas Anderson (screenplay), Upton Sinclair (novel)","Daniel Day-Lewis, Martin Stringer, Matthew Braden Stringer, Jacob Stringer","A story of family, religion, hatred, oil and madness, focusing on a turn-of-the-century prospector in the early days of the business.","English, American Sign Language",USA,2.00,0.00,92.00,8.10,402281.00,tt0469494,8-Apr-08,50481000.00,Paramount Vantage
177,How to Train Your Dragon,2010.00,PG,26-Mar-10,98 min,"Animation, Action, Adventure","Dean DeBlois, Chris Sanders","William Davies (screenplay), Dean DeBlois (screenplay), Chris Sanders (screenplay), Cressida Cowell (book)","Jay Baruchel, Gerard Butler, Craig Ferguson, America Ferrera","A hapless young Viking who aspires to hunt dragons becomes the unlikely friend of a young dragon himself, and learns there may be more to the creatures than he assumed.",English,USA,0.00,2.00,74.00,8.10,528657.00,tt0892769,15-Oct-10,248849100.00,Paramount/DWA
178,Kill Bill: Vol. 1,2003.00,R,10-Oct-03,111 min,"Action, Crime, Thriller",Quentin Tarantino,"Quentin Tarantino, Quentin Tarantino (character The Bride), Uma Thurman (character The Bride)","Uma Thurman, Lucy Liu, Vivica A. Fox, Daryl Hannah",The Bride wakens from a four-year coma. The child she carried in her womb is gone. Now she must wreak vengeance on the team of assassins who betrayed her - a team she was once part of.,"English, Japanese, French",USA,0.00,0.00,69.00,8.10,791579.00,tt0266697,13-Apr-04,104717600.00,Miramax Films
179,Come and See,1985.00,NOT RATED,17-Oct-85,142 min,"Drama, War",Elem Klimov,"Ales Adamovich (story), Ales Adamovich (screenplay), Elem Klimov (screenplay)","Aleksey Kravchenko, Olga Mironova, Liubomiras Laucevicius, Vladas Bagdonas","After finding an old rifle, a young boy joins the Soviet resistance movement against ruthless German forces and experiences the horrors of World War II.","Belarusian, Russian, German",Soviet Union,0.00,0.00,N/A,8.30,30443.00,tt0091251,23-Oct-01,N/A,Kino International
180,Mary and Max,2009.00,NOT RATED,9-Apr-09,92 min,"Animation, Comedy, Drama",Adam Elliot,Adam Elliot,"Toni Collette, Philip Seymour Hoffman, Barry Humphries, Eric Bana","A tale of friendship between two unlikely pen pals: Mary, a lonely, eight-year-old girl living in the suburbs of Melbourne, and Max, a forty-four-year old, severely obese man living in New York.","English, Yiddish",Australia,0.00,0.00,N/A,8.20,129873.00,tt0978762,15-Jun-10,N/A,IFC Films
181,Gone Girl,2014.00,R,3-Oct-14,149 min,"Crime, Drama, Mystery",David Fincher,"Gillian Flynn (screenplay), Gillian Flynn (novel)","Ben Affleck, Rosamund Pike, Neil Patrick Harris, Tyler Perry","With his wife's disappearance having become the focus of an intense media circus, a man sees the spotlight turned on him when it's suspected that he may not be innocent.",English,USA,0.00,1.00,79.00,8.10,640332.00,tt2267998,13-Jan-15,182172500.00,20th Century Fox
182,Into the Wild,2007.00,R,19-Oct-07,148 min,"Adventure, Biography, Drama",Sean Penn,"Sean Penn (screenplay), Jon Krakauer (book)","Emile Hirsch, Marcia Gay Harden, William Hurt, Jena Malone","After graduating from Emory University, top student and athlete Christopher McCandless abandons his possessions, gives his entire $24,000 savings account to charity and hitchhikes to Alaska to live in the wilderness. Along the way, Christopher encounters a series of characters that shape his life.","English, Danish",USA,0.00,2.00,73.00,8.10,461312.00,tt0758758,4-Mar-08,23955200.00,Paramount Vantage
183,It Happened One Night,1934.00,UNRATED,22-Feb-34,105 min,"Comedy, Romance",Frank Capra,"Robert Riskin (screen play), Samuel Hopkins Adams (based on the short story by)","Clark Gable, Claudette Colbert, Walter Connolly, Roscoe Karns",A spoiled heiress running away from her family is helped by a man who is actually a reporter in need of a story.,English,USA,5.00,0.00,N/A,8.20,70807.00,tt0025316,28-Dec-99,N/A,Sony Pictures Home Entertainment
184,Shutter Island,2010.00,R,19-Feb-10,138 min,"Mystery, Thriller",Martin Scorsese,"Laeta Kalogridis (screenplay), Dennis Lehane (novel)","Leonardo DiCaprio, Mark Ruffalo, Ben Kingsley, Max von Sydow","In 1954, a U.S. marshal investigates the disappearance of a murderess who escaped from a hospital for the criminally insane.","English, German",USA,0.00,0.00,63.00,8.10,862078.00,tt1130884,8-Jun-10,145187900.00,Paramount Studios
185,Life of Brian,1979.00,R,17-Aug-79,94 min,Comedy,Terry Jones,"Graham Chapman, John Cleese, Terry Gilliam, Eric Idle, Terry Jones, Michael Palin","Graham Chapman, John Cleese, Terry Gilliam, Eric Idle","Brian is born on the original Christmas, in the stable next door. He spends his life being mistaken for a messiah.","English, Latin",UK,0.00,0.00,75.00,8.10,291865.00,tt0079470,30-Apr-99,69632500.00,Warner Bros. Pictures
186,Platoon,1986.00,R,6-Feb-87,120 min,"Drama, War",Oliver Stone,Oliver Stone,"Tom Berenger, Keith David, Willem Dafoe, Forest Whitaker",A young recruit in Vietnam faces a moral crisis when confronted with the horrors of war and the duality of man.,"English, Vietnamese","UK, USA",4.00,0.00,92.00,8.10,311879.00,tt0091763,9-Dec-97,319278400.00,Orion Pictures
187,Wild Tales,2014.00,R,21-Aug-14,122 min,"Comedy, Drama, Thriller",Damiíçn Szifron,Damiíçn Szifron,"Darí_o Grandinetti, Marí_a Marull, Mí_nica Villa, Rita Cortese",Six short stories that explore the extremities of human behavior involving people in distress.,Spanish,"Argentina, Spain",0.00,1.00,77.00,8.10,112743.00,tt3011894,16-Jun-15,3341900.00,Sony Pictures Classics
188,Hotel Rwanda,2004.00,PG-13,4-Feb-05,121 min,"Biography, Drama, History",Terry George,"Keir Pearson, Terry George","Don Cheadle, Xolani Mali, Desmond Dube, Hakeem Kae-Kazim",Paul Rusesabagina was a hotel manager who housed over a thousand Tutsi refugees during their struggle against the Hutu militia in Rwanda.,"English, French","UK, South Africa, Italy",0.00,3.00,79.00,8.10,282079.00,tt0395169,12-Apr-05,33088300.00,MGM
189,Rush,2013.00,R,27-Sep-13,123 min,"Action, Biography, Drama",Ron Howard,Peter Morgan,"Chris Hemsworth, Daniel Brí_hl, Olivia Wilde, Alexandra Maria Lara",The merciless 1970s rivalry between Formula One rivals James Hunt and Niki Lauda.,"English, German, Italian, French, Spanish","UK, Germany, USA",0.00,0.00,75.00,8.10,341336.00,tt1979320,28-Jan-14,29095900.00,Universal Pictures
190,The Wages of Fear,1953.00,NOT RATED,16-Feb-55,131 min,"Adventure, Drama, Thriller",Henri-Georges Clouzot,"Georges Arnaud (novel), Henri-Georges Clouzot (adaptation), Jí©ríÇme Gí©ronimi (adaptation)","Yves Montand, Charles Vanel, Folco Lulli, Peter van Eyck","In a decrepit South American village, four men are hired to transport an urgent nitroglycerine shipment without the equipment that would make it safe.","French, English, Spanish, German, Italian, Russian","France, Italy",0.00,0.00,N/A,8.20,38646.00,tt0046268,26-Jan-99,N/A,Janus Films
191,Network,1976.00,R,27-Nov-76,121 min,Drama,Sidney Lumet,Paddy Chayefsky,"Faye Dunaway, William Holden, Peter Finch, Robert Duvall",A television network cynically exploits a deranged former anchor's ravings and revelations about the news media for its own profit.,English,USA,4.00,,88.00,8.10,111892.00,tt0074958,16-May-00,100209300.00,MGM/United Artists
192,In the Name of the Father,1993.00,R,25-Feb-94,133 min,"Biography, Drama",Jim Sheridan,"Gerry Conlon (autobiographical book ""Proved Innocent""), Terry George (screenplay), Jim Sheridan (screenplay)","Alison Crosbie, Daniel Day-Lewis, Philip King, Emma Thompson",A man's coerced confession to an IRA bombing he did not commit results in the imprisonment of his father as well. An English lawyer fights to free them.,English,"Ireland, UK, USA",0.00,7.00,84.00,8.10,119905.00,tt0107207,7-Jul-98,54096300.00,Universal Pictures
193,Stand by Me,1986.00,R,22-Aug-86,89 min,"Adventure, Drama",Rob Reiner,"Stephen King (novel), Raynold Gideon (screenplay), Bruce A. Evans (screenplay)","Wil Wheaton, River Phoenix, Corey Feldman, Jerry O'Connell","After the death of a friend, a writer recounts a boyhood journey to find the body of a missing boy.",English,USA,0.00,1.00,75.00,8.10,292157.00,tt0092005,29-Aug-00,126983700.00,MCA Universal Home Video
194,The 400 Blows,1959.00,NOT RATED,16-Nov-59,99 min,"Crime, Drama",Franí_ois Truffaut,"Franí_ois Truffaut (scenario), Marcel Moussy (adaptation), Franí_ois Truffaut (adaptation), Marcel Moussy (dialogue)","Jean-Pierre Lí©aud, Claire Maurier, Albert Rí©my, Guy Decomble","Moving story of a young boy who, left without attention, delves into a life of petty crime.","French, English",France,0.00,1.00,N/A,8.10,76599.00,tt0053198,24-Mar-98,N/A,Zenith International Films
195,Ben-Hur,1959.00,G,29-Jan-60,212 min,"Adventure, Drama, History",William Wyler,"Lew Wallace (novel), Karl Tunberg (screenplay)","Charlton Heston, Jack Hawkins, Haya Harareet, Stephen Boyd","When a Jewish prince is betrayed and sent into slavery by a Roman friend, he regains his freedom and comes back for revenge.",English,USA,11.00,0.00,90.00,8.10,175529.00,tt0052618,13-Sep-05,882980000.00,MGM
196,The Grand Budapest Hotel,2014.00,R,28-Mar-14,99 min,"Adventure, Comedy, Drama",Wes Anderson,"Stefan Zweig (inspired by the writings of), Wes Anderson (screenplay), Wes Anderson (story), Hugo Guinness (story)","Ralph Fiennes, F. Murray Abraham, Mathieu Amalric, Adrien Brody","The adventures of Gustave H, a legendary concierge at a famous hotel from the fictional Republic of Zubrowka between the first and second World Wars, and Zero Moustafa, the lobby boy who becomes his most trusted friend.","English, French","USA, Germany",4.00,0.00,88.00,8.10,537323.00,tt2278388,17-Jun-14,64956100.00,Fox Searchlight
197,Spotlight,2015.00,R,20-Nov-15,128 min,"Crime, Drama, History",Tom McCarthy,"Josh Singer, Tom McCarthy","Mark Ruffalo, Michael Keaton, Rachel McAdams, Liev Schreiber","The true story of how the Boston Globe uncovered the massive scandal of child molestation and cover-up within the local Catholic Archdiocese, shaking the entire Catholic Church to its core.",English,"USA, Canada",2.00,0.00,93.00,8.10,274216.00,tt1895587,23-Feb-16,46926900.00,Open Road Films
198,Mad Max: Fury Road,2015.00,R,15-May-15,120 min,"Action, Adventure, Sci-Fi",George Miller,"George Miller, Brendan McCarthy, Nick Lathouris","Tom Hardy, Charlize Theron, Nicholas Hoult, Hugh Keays-Byrne","A woman rebels against a tyrannical ruler in postapocalyptic Australia in search for her home-land with the help of a group of female prisoners, a psychotic worshipper, and a drifter named Max.","English, Russian","Australia, USA",6.00,0.00,90.00,8.10,638510.00,tt1392190,1-Sep-15,161152700.00,Warner Bros.
199,12 Years a Slave,2013.00,R,8-Nov-13,134 min,"Biography, Drama, History",Steve McQueen,"John Ridley (screenplay), Solomon Northup (based on ""Twelve Years a Slave"" by)","Chiwetel Ejiofor, Dwight Henry, Dickie Gravois, Bryan Batt","In the antebellum United States, Solomon Northup, a free black man from upstate New York, is abducted and sold into slavery.",English,"USA, UK",3.00,0.00,96.00,8.10,490387.00,tt2024544,4-Mar-14,62147400.00,Fox Searchlight
200,Persona,1966.00,NOT RATED,16-Mar-67,83 min,"Drama, Thriller",Ingmar Bergman,Ingmar Bergman (story and screenplay),"Bibi Andersson, Liv Ullmann, Margaretha Krook, Gunnar Bjí_rnstrand",A nurse is put in charge of a mute actress and finds that their personas are melding together.,"Swedish, English",Sweden,0.00,0.00,N/A,8.10,68948.00,tt0060827,16-Mar-04,N/A,Criterion Collection
201,Million Dollar Baby,2004.00,PG-13,28-Jan-05,132 min,"Drama, Sport",Clint Eastwood,"Paul Haggis (screenplay), F.X. Toole (stories)","Clint Eastwood, Hilary Swank, Morgan Freeman, Jay Baruchel",A determined woman works with a hardened boxing trainer to become a professional.,"English, Irish",USA,4.00,0.00,86.00,8.10,519405.00,tt0405159,12-Jul-05,141288400.00,Warner Bros. Pictures
202,Butch Cassidy and the Sundance Kid,1969.00,PG,24-Oct-69,110 min,"Biography, Crime, Drama",George Roy Hill,William Goldman,"Paul Newman, Robert Redford, Katharine Ross, Strother Martin",Two Western bank/train robbers flee to Bolivia when the law gets too close.,"English, Spanish",USA,4.00,0.00,58.00,8.10,163664.00,tt0064115,16-May-00,635726300.00,20th Century Fox
203,Jurassic Park,1993.00,PG-13,11-Jun-93,127 min,"Adventure, Sci-Fi, Thriller",Steven Spielberg,"Michael Crichton (novel), Michael Crichton (screenplay), David Koepp (screenplay)","Sam Neill, Laura Dern, Jeff Goldblum, Richard Attenborough","During a preview tour, a theme park suffers a major power breakdown that allows its cloned dinosaur exhibits to run amok.","English, Spanish",USA,3.00,0.00,68.00,8.10,670652.00,tt0107290,10-Oct-00,776714600.00,Universal City Studios
204,Memories of Murder,2003.00,UNRATED,2-May-03,132 min,"Crime, Drama, Mystery",Bong Joon Ho,"Bong Joon Ho, Kwang-rim Kim (play), Sung-bo Shim","Kang-ho Song, Sang-kyung Kim, Roe-ha Kim, Jae-ho Song","In a small Korean province in 1986, three detectives struggle with the case of multiple young women being found raped and murdered by an unknown culprit.","Korean, English",South Korea,0.00,0.00,82.00,8.10,76875.00,tt0353969,12-Jun-91,21600.00,Houston Lady Productions
205,Amores Perros,2000.00,R,13-Apr-01,154 min,"Drama, Thriller",Alejandro Gonzíçlez Ií±íçrritu,Guillermo Arriaga,"Emilio Echevarrí_a, Gael Garcí_a Bernal, Goya Toledo, ílvaro Guerrero","A horrific car accident connects three stories, each involving characters dealing with loss, regret, and life's harsh realities, all in the name of love.",Spanish,Mexico,0.00,1.00,83.00,8.10,184555.00,tt0245712,25-Sep-01,8609600.00,Lions Gate Films
206,The Maltese Falcon,1941.00,APPROVED,18-Oct-41,100 min,"Film-Noir, Mystery",John Huston,"John Huston (screenplay), Dashiell Hammett (based upon the novel by)","Humphrey Bogart, Mary Astor, Gladys George, Peter Lorre","A private detective takes on a case that involves him with three eccentric criminals, a gorgeous liar, and their quest for a priceless statuette.",English,USA,0.00,3.00,N/A,8.10,122177.00,tt0033870,15-Feb-00,N/A,Warner Bros.
207,Munna Bhai M.B.B.S.,2003.00,NOT RATED,19-Dec-03,156 min,"Comedy, Drama, Romance",Rajkumar Hirani,"Vidhu Vinod Chopra (screenplay), Rajkumar Hirani (screenplay), Rajkumar Hirani, Lajan Joseph (screenplay), Abbas Tyrewala (dialogue)","Sunil Dutt, Sanjay Dutt, Arshad Warsi, Gracy Singh",A gangster sets out to fulfill his father's dream of becoming a doctor.,Hindi,India,0.00,0.00,N/A,8.20,52091.00,tt0374887,30-Mar-04,N/A,N/A
208,Stalker,1979.00,NOT RATED,17-Apr-80,163 min,"Drama, Sci-Fi",Andrei Tarkovsky,"Arkadiy Strugatskiy (novel), Boris Strugatskiy (novel), Arkadiy Strugatskiy (screenplay), Boris Strugatskiy (screenplay)","Alisa Freyndlikh, Aleksandr Kaydanovskiy, Anatoliy Solonitsyn, Nikolay Grinko",A guide leads two men through an area known as the Zone to find a room that grants wishes.,Russian,Soviet Union,0.00,0.00,N/A,8.10,76654.00,tt0079944,15-Oct-02,164141.00,Zweites Deutsches Fernsehen
209,The Truman Show,1998.00,PG,5-Jun-98,103 min,"Comedy, Drama, Sci-Fi",Peter Weir,Andrew Niccol,"Jim Carrey, Laura Linney, Noah Emmerich, Natascha McElhone",An insurance salesman/adjuster discovers his entire life is actually a television show.,English,USA,0.00,3.00,90.00,8.10,724665.00,tt0120382,26-Jan-99,241326200.00,Paramount Pictures
210,The Nights of Cabiria,1957.00,NOT RATED,16-Oct-57,110 min,Drama,Federico Fellini,"Federico Fellini (story), Ennio Flaiano (story), Tullio Pinelli (story), Federico Fellini (screenplay), Ennio Flaiano (screenplay), Tullio Pinelli (screenplay), Pier Paolo Pasolini (collaboration)","Giulietta Masina, Franí_ois Pí©rier, Franca Marzi, Dorian Gray",A waifish prostitute wanders the streets of Rome looking for true love but finds only heartbreak.,Italian,"Italy, France",1.00,0.00,N/A,8.20,29367.00,tt0050783,7-Sep-99,N/A,Lopert Pictures Corporation
211,The Princess Bride,1987.00,PG,9-Oct-87,98 min,"Adventure, Family, Fantasy",Rob Reiner,"William Goldman (book), William Goldman (screenplay)","Cary Elwes, Mandy Patinkin, Chris Sarandon, Christopher Guest","While home sick in bed, a young boy's grandfather reads him a story called The Princess Bride.",English,USA,0.00,1.00,77.00,8.10,314262.00,tt0093779,26-Jan-99,71107100.00,20th Century Fox
212,Hachi: A Dog's Tale,2009.00,G,12-Mar-10,93 min,"Drama, Family",Lasse Hallstrí_m,"Stephen P. Lindsey (screenplay), Kaneto ShindíÇ (motion picture ""Hachiko monogatari"")","Richard Gere, Joan Allen, Cary-Hiroyuki Tagawa, Sarah Roemer",A college professor's bond with the abandoned dog he takes into his home.,"English, Japanese","UK, USA",0.00,0.00,N/A,8.10,179414.00,tt1028532,9-Mar-10,N/A,Inferno Entertainment
213,Nausicaí_ of the Valley of the Wind,1984.00,PG,11-Mar-84,117 min,"Animation, Adventure, Fantasy",Hayao Miyazaki,"Hayao Miyazaki (comic), Hayao Miyazaki (screenplay), Cindy Davis Hewitt (english version), Donald H. Hewitt (english version)","Sumi Shimamoto, Mahito Tsujimura, Hisako KyíÇda, GoríÇ Naya",Warrior/pacifist Princess Nausicaí_ desperately struggles to prevent two warring nations from destroying themselves and their dying planet.,"Japanese, English","Japan, USA",0.00,0.00,N/A,8.10,106455.00,tt0087544,22-Feb-05,495800.00,Starmaker Entertainment
